{
  "_schema_version": 1,
  "version": "1.0.0",
  "last_changed": "2026-05-25",
  "primary_key": {
    "strategy": "uuid_v7",
    "function": "uuid_generate_v7()",
    "sql_type": "UUID",
    "rationale": "Time-ordered UUIDs cluster well in B-tree indexes (unlike v4) and avoid index hot-spots that BIGSERIAL would create under high write rate. Single PK strategy across all tables keeps the migration generator and entity generator uniform."
  },
  "extensions_required": [
    {
      "name": "uuid-ossp",
      "purpose": "Provides uuid_generate_v4 fallback and is required by some uuid_v7 implementations."
    },
    {
      "name": "pgcrypto",
      "purpose": "gen_random_uuid() used in seed migrations; some uuid_v7 implementations build on it."
    },
    {
      "name": "pg_trgm",
      "purpose": "Trigram indexes for substring search on names, codes and descriptions."
    },
    {
      "name": "unaccent",
      "purpose": "Accent-insensitive search (LOWER(unaccent(nome)) LIKE ...)."
    }
  ],
  "audit_columns": {
    "created_at": "criado_em",
    "created_by": "criado_por_usuario_id",
    "updated_at": "atualizado_em",
    "updated_by": "atualizado_por_usuario_id",
    "type_timestamp": "TIMESTAMPTZ NOT NULL DEFAULT now()",
    "type_user": "UUID",
    "applies_to": "all_root_aggregates"
  },
  "soft_delete": {
    "column": "ativo",
    "type": "BOOLEAN NOT NULL DEFAULT TRUE",
    "deletion_table": "exclusao_documento",
    "applies_to": "all_root_aggregates"
  },
  "column_types": [
    {
      "name": "monetary",
      "sql_type": "NUMERIC(15,2)",
      "java_type": "java.math.BigDecimal",
      "description": "Money amounts (BRL). 13 digits before the decimal handles totals well into the billions, 2 decimals match centavos."
    },
    {
      "name": "quantity",
      "sql_type": "NUMERIC(15,4)",
      "java_type": "java.math.BigDecimal",
      "description": "Item quantities. 4 decimals accommodate fractional units (kg, m³, hours)."
    },
    {
      "name": "unit_price",
      "sql_type": "NUMERIC(15,4)",
      "java_type": "java.math.BigDecimal",
      "description": "Unit prices that may have sub-cent precision (e.g. tax rates applied per unit)."
    },
    {
      "name": "percentage",
      "sql_type": "NUMERIC(5,2)",
      "java_type": "java.math.BigDecimal",
      "description": "Percentages 0..100 with 2 decimals. Always validated with CHECK (col BETWEEN 0 AND 100)."
    },
    {
      "name": "tenant_id_slug",
      "sql_type": "VARCHAR(50)",
      "java_type": "java.lang.String",
      "description": "Tenant id slug like 'emp_alpha' (matches schema name)."
    },
    {
      "name": "code_short",
      "sql_type": "VARCHAR(20)",
      "java_type": "java.lang.String",
      "description": "Short codes (UFs, CFOPs, status enums, numbered identifiers like 'ORC-2026-00042')."
    },
    {
      "name": "name_long",
      "sql_type": "VARCHAR(150)",
      "java_type": "java.lang.String",
      "description": "Long human names (cliente.nome, produto.descricao)."
    }
  ],
  "numbering": {
    "pattern": "<PREFIX>-<YEAR>-<SERIAL>",
    "format_example": "ORC-2026-00042",
    "serial_padding": 5,
    "sequence_pattern": "seq_<entity>_numero",
    "column_type": "VARCHAR(20)"
  },
  "schema_annotation": {
    "comment_prefix": "-- schema: ",
    "valid_values": [
      "global",
      "{{ multi_tenancy_term }}"
    ],
    "description": "First line of every DDL block declares its target schema. be-migration-generator routes the block to db/migration/<schema>/V<N>__<module>_<description>.sql accordingly."
  },
  "fk_rule": {
    "same_schema": "physical_fk",
    "cross_schema": "logical_fk",
    "logical_fk_description": "Cross-schema FK uses a UUID column WITHOUT REFERENCES; referential integrity is enforced in the application service (with a lookup that fails with not_found before persisting).",
    "rationale": "Postgres does support cross-schema FK in principle but it complicates per-tenant schema lifecycle (drop, restore, migration). Logical FK with service-level validation keeps schemas independently movable."
  },
  "snapshot_pattern": {
    "suffix": "_snapshot",
    "immutability_trigger": "status IN ('CONFIRMADA','FATURADA','CANCELADA')",
    "description": "Fields suffixed with _snapshot are immutable once the parent aggregate transitions to a closed state. Enforced in the application service (rejects updates) and in the cancellation policy (cancellation creates a new immutable record rather than mutating the original).",
    "adr": "ADR-005"
  },
  "encoding": "UTF-8"
}
